<!--
   DO NOT ALTER OR REMOVE COPYRIGHT NOTICES OR THIS HEADER.
  
   Copyright (c) 2007 Sun Microsystems Inc. All Rights Reserved
  
   The contents of this file are subject to the terms
   of the Common Development and Distribution License
   (the License). You may not use this file except in
   compliance with the License.

   You can obtain a copy of the License at
   https://opensso.dev.java.net/public/CDDLv1.0.html or
   opensso/legal/CDDLv1.0.txt
   See the License for the specific language governing
   permission and limitations under the License.

   When distributing Covered Code, include this CDDL
   Header Notice in each file and include the License file
   at opensso/legal/CDDLv1.0.txt.
   If applicable, add the following below the CDDL Header,
   with the fields enclosed by brackets [] replaced by
   your own identifying information:
   "Portions Copyrighted [year] [name of copyright owner]"

   $Id: propertyG11NSupportedCharsets_Readonly.xml,v 1.2 2008/06/25 05:45:11 qcheng Exp $

-->

<!--
    Portions Copyrighted 2011 ForgeRock AS
-->

<!DOCTYPE propertysheet SYSTEM "propertysheet.dtd">

<propertysheet>
    <section name="dummy" defaultValue="blank.header">
    <property>
	<label name="lblLocale" defaultValue="globalization.service.table.SupportedCharsets.locale" labelFor="locale" />
	<cc name="locale" tagclass="com.sun.web.ui.taglib.html.CCStaticTextFieldTag" />
        <fieldhelp name="helpLocale" defaultValue="globalization.service.table.SupportedCharsets.locale.help" />
    </property>
    <property>
	<label name="lblCharsets" defaultValue="globalization.service.table.SupportedCharsets.charsets" labelFor="charsets" />
	<cc name="charsets" tagclass="com.sun.web.ui.taglib.html.CCStaticTextFieldTag" />
	<fieldhelp name="helpCharsets" defaultValue="globalization.service.table.SupportedCharsets.charsets.help" />
    </property>
    </section>
</propertysheet>
